{
  "artifacts": [
    {
      "archive_path": "artifacts/elf/production-candidate",
      "format": "ELF-aarch64",
      "role": "production-candidate",
      "sha256": "52119143688b0f2c92deb0ef019c7ee6c5deba8830c5011daa5b2fdd5554b594",
      "size_bytes": 513648,
      "source_locator": "/private/tmp/g4-029-post-gates-protective/run-002/roots/candidate/solution"
    },
    {
      "archive_path": "artifacts/elf/production-control",
      "format": "ELF-aarch64",
      "role": "production-control",
      "sha256": "5d9b87076929726411a65d93e5fe1988a71f41ebbcf541c52843f1397c4c4110",
      "size_bytes": 491520,
      "source_locator": "/private/tmp/g4-029-post-gates-protective/run-002/roots/control/solution"
    },
    {
      "archive_path": "artifacts/elf/grammar-shadow-candidate",
      "format": "ELF-aarch64",
      "role": "grammar-shadow-candidate",
      "sha256": "25a4f93c4e3f3524e69f35409c6b8b207e172e6a7c786c96e98b2c5f273aab08",
      "size_bytes": 527984,
      "source_locator": "/private/tmp/g4-029-formal-shadow-v2/run-002/roots/candidate/solution"
    },
    {
      "archive_path": "artifacts/elf/sanitizer-candidate",
      "format": "ELF-aarch64",
      "role": "sanitizer-candidate",
      "sha256": "01fdb6d9f7791b0899e583199ea05df0ab35364bae516e17e5c41e7868705eb0",
      "size_bytes": 16633328,
      "source_locator": "/private/tmp/g4-029-sanitizer-startup/roots/candidate/solution"
    },
    {
      "archive_path": "artifacts/elf/sanitizer-native-driver",
      "format": "ELF-aarch64",
      "role": "sanitizer-native-driver",
      "sha256": "2bf0464919f312c350173b247d69177e17ba1d01fa39a7a05824cc6ad11fd8e5",
      "size_bytes": 14922568,
      "source_locator": "/private/tmp/g4-029-sanitizer-startup/roots/candidate/native_semantic_driver_sanitizer"
    },
    {
      "archive_path": "artifacts/runtime/candidate/cl100k_base.bin",
      "format": "runtime-data",
      "role": "generated-candidate-cl100k",
      "sha256": "308b0361bc24138a3ba3b3659cc09083f2d8fcd5dcd080a407b499e97cc2fd34",
      "size_bytes": 1447331,
      "source_locator": "/private/tmp/g4-029-post-gates-protective/run-002/roots/candidate/generated/cl100k_base.bin"
    },
    {
      "archive_path": "artifacts/runtime/candidate/context.bin",
      "format": "runtime-data",
      "role": "generated-candidate-context",
      "sha256": "5fe131cdb2f0fdb3e7bfbc1a527f469873324b95d455e081306369f96b77c765",
      "size_bytes": 5521,
      "source_locator": "/private/tmp/g4-029-post-gates-protective/run-002/roots/candidate/generated/context.bin"
    },
    {
      "archive_path": "artifacts/runtime/control/cl100k_base.bin",
      "format": "runtime-data",
      "role": "generated-control-cl100k",
      "sha256": "308b0361bc24138a3ba3b3659cc09083f2d8fcd5dcd080a407b499e97cc2fd34",
      "size_bytes": 1447331,
      "source_locator": "/private/tmp/g4-029-post-gates-protective/run-002/roots/control/generated/cl100k_base.bin"
    },
    {
      "archive_path": "artifacts/runtime/control/context.bin",
      "format": "runtime-data",
      "role": "generated-control-context",
      "sha256": "5fe131cdb2f0fdb3e7bfbc1a527f469873324b95d455e081306369f96b77c765",
      "size_bytes": 5521,
      "source_locator": "/private/tmp/g4-029-post-gates-protective/run-002/roots/control/generated/context.bin"
    }
  ],
  "bundle_id": "g4-029-identifier-independent-acceptance",
  "candidate": {
    "commit": "029531cecaea28b765455559805fe45c31011b54",
    "cpp_solution_sha256": "b8fdd70f0d71f37e0ebb93fd8388d1a70dcca6b54aecf14f02a0c84f56170838",
    "production_elf_sha256": "52119143688b0f2c92deb0ef019c7ee6c5deba8830c5011daa5b2fdd5554b594",
    "tree": "cbb1d3fc1136ed622dbf3bd4612b4bbe86107e55"
  },
  "control": {
    "commit": "f5f2468c343e7ccc18d48cba0eab0a10920ee1c6",
    "production_elf_sha256": "5d9b87076929726411a65d93e5fe1988a71f41ebbcf541c52843f1397c4c4110",
    "tree": "147f5917a6717435f8681e851997ca7387b188b1"
  },
  "determinism": {
    "entry_order": "UTF-8/POSIX archive path",
    "gid": 0,
    "gname": "",
    "gzip_header_mtime": 0,
    "tar_mtime": 0,
    "uid": 0,
    "uname": ""
  },
  "durable_repo_path": "baseline_results/20260815_g4_identifier_independent_acceptance",
  "evidence": [
    {
      "archive_path": "evidence/formal/production-correctness-run004",
      "claim_checks": [
        {
          "archive_path": "evidence/formal/production-correctness-run004/validation_summary.json",
          "assertions": [
            {
              "equals": true,
              "pointer": "/all_validated"
            },
            {
              "equals": "52119143688b0f2c92deb0ef019c7ee6c5deba8830c5011daa5b2fdd5554b594",
              "pointer": "/candidate_elf_sha256"
            },
            {
              "equals": "5d9b87076929726411a65d93e5fe1988a71f41ebbcf541c52843f1397c4c4110",
              "pointer": "/control_elf_sha256"
            }
          ],
          "sha256": "91e67c3b5da57ec57254999b3b420ad9edfc62292e3705c36cfacc72a40b5d80"
        },
        {
          "archive_path": "evidence/formal/production-correctness-run004/run_exit.json",
          "assertions": [
            {
              "equals": 0,
              "pointer": "/exit_code"
            }
          ],
          "sha256": "9ecc8fc650667ed39a70e66a704c231634a5a068ed5a4808e09e439d8ebfaf86"
        }
      ],
      "id": "production-correctness-run004",
      "included": true,
      "internal_manifest": {
        "archive_path": "evidence/formal/production-correctness-run004/SHA256SUMS",
        "entry_count": 49,
        "historical_bytes_preserved": true,
        "path_mappings": [
          {
            "from_prefix": "/evidence/",
            "to_prefix": "evidence/formal/production-correctness-run004/"
          }
        ],
        "sha256": "060ad898aaade464f95c1267affe9ece2d96dfa5ec8126a04de3c902fa0a15de"
      },
      "may_contribute": true,
      "required_for_final": false,
      "source_locator": "/private/tmp/g4-029-correctness/run-004/evidence",
      "status": "pass",
      "tier": "formal",
      "title": "Default-production correctness",
      "tree_binding": {
        "algorithm": "sha256(sorted(relative_path + NUL + file_sha256 + LF))",
        "file_count": 50,
        "sha256": "3bbac9d488b802ef3e991c0f703f921e3195c61a214f3856c933458529f42297",
        "total_file_bytes": 3066508
      }
    },
    {
      "archive_path": "evidence/formal/sanitizer",
      "claim_checks": [
        {
          "archive_path": "evidence/formal/sanitizer/validation_summary.json",
          "assertions": [
            {
              "equals": "PASS",
              "pointer": "/status"
            },
            {
              "equals": "01fdb6d9f7791b0899e583199ea05df0ab35364bae516e17e5c41e7868705eb0",
              "pointer": "/candidate_sanitizer_elf_sha256"
            },
            {
              "equals": "2bf0464919f312c350173b247d69177e17ba1d01fa39a7a05824cc6ad11fd8e5",
              "pointer": "/native_driver_sanitizer_elf_sha256"
            }
          ],
          "sha256": "40380756e050fa5a8d40e7f7350644b527c2926e2fa4bbf88b88d6139f36ea5a"
        },
        {
          "archive_path": "evidence/formal/sanitizer/run_exit.json",
          "assertions": [
            {
              "equals": 0,
              "pointer": "/exit_code"
            }
          ],
          "sha256": "d3be133968994254420a4d44ff0fade980ceb813f96452e9e153f22a68a91178"
        }
      ],
      "id": "sanitizer",
      "included": true,
      "internal_manifest": {
        "archive_path": "evidence/formal/sanitizer/SHA256SUMS",
        "entry_count": 62,
        "historical_bytes_preserved": true,
        "path_mappings": [
          {
            "from_prefix": "/evidence/",
            "to_prefix": "evidence/formal/sanitizer/"
          }
        ],
        "sha256": "eb1aa9c07758dd6882f55a3ca5ff4c051152af12f8d1f47a10a1033c3c797d87"
      },
      "may_contribute": true,
      "required_for_final": false,
      "source_locator": "/private/tmp/g4-029-sanitizer-startup/sanitizer/evidence",
      "status": "pass",
      "tier": "formal",
      "title": "ASan/LSan/UBSan correctness",
      "tree_binding": {
        "algorithm": "sha256(sorted(relative_path + NUL + file_sha256 + LF))",
        "file_count": 63,
        "sha256": "ad44928ba7a36c46f67787219962492b24454443809f131da1c22b81876e8c6e",
        "total_file_bytes": 3085808
      }
    },
    {
      "archive_path": "evidence/formal/startup-multicpu",
      "claim_checks": [
        {
          "archive_path": "evidence/formal/startup-multicpu/validation_summary.json",
          "assertions": [
            {
              "equals": "PASS",
              "pointer": "/status"
            },
            {
              "equals": "multi-cpu",
              "pointer": "/mode"
            },
            {
              "equals": "52119143688b0f2c92deb0ef019c7ee6c5deba8830c5011daa5b2fdd5554b594",
              "pointer": "/candidate_production_elf_sha256"
            }
          ],
          "sha256": "a13b9759cb4d6b598b9639f85109413deeff0904abf3f46cff88c7971b7dd523"
        },
        {
          "archive_path": "evidence/formal/startup-multicpu/run_exit.json",
          "assertions": [
            {
              "equals": 0,
              "pointer": "/exit_code"
            }
          ],
          "sha256": "45c247cb5de761ae7340a303f4f19bf307b5a2b51430689ff1f7a2542dcafe7f"
        }
      ],
      "id": "startup-multicpu",
      "included": true,
      "internal_manifest": {
        "archive_path": "evidence/formal/startup-multicpu/SHA256SUMS",
        "entry_count": 33,
        "historical_bytes_preserved": true,
        "path_mappings": [
          {
            "from_prefix": "/evidence/",
            "to_prefix": "evidence/formal/startup-multicpu/"
          }
        ],
        "sha256": "ae5251f72a563b738975cdcacddc39b7df513974dc2d211865539826d4efd811"
      },
      "may_contribute": true,